{
  "certification_version": "PHASE4B_CERT_V1",
  "evidence_kind": "EXAMPLE_FIXTURE",
  "git_commit": "0000000000000000000000000000000000000000",
  "worktree_dirty": true,
  "scenario_version": "PHASE4B_ACCELERATED_RTH_V1",
  "scenario_sha256": "0000000000000000000000000000000000000000000000000000000000000000",
  "configuration_versions": {"example": "not-runtime-evidence"},
  "run_id": "00000000-0000-4000-8000-000000000000",
  "trace": [{"record_id": "example-1", "kind": "example"}],
  "universe": {"epoch_count": 0, "contracts_evaluated": 0, "contracts_admitted": 0, "contracts_removed": 0, "paired_capacity": {"trade": 0, "quote": 0}, "acknowledgements": {"accepted": 0, "duplicate_or_unmatched_rejected": 0}},
  "events": {"events": 0, "quotes": 0, "clusters": 0, "decisions": 0},
  "persistence": {"enqueued": 0, "drained": 0, "queue_depth_final": 0},
  "replay_equality": false,
  "comparison_matrix": [{"cluster_id": "example", "control": false, "shadow": false, "comparison": "EXAMPLE"}],
  "delta_provenance": {"recognized": 0, "missing_or_unsupported": 0, "unscoreable_reasons": []},
  "finalization": {"status": "INCOMPLETE"},
  "orders": {"trading_enabled": false, "constructed": 0, "submitted": 0},
  "invariants": {"example": {"status": "FAIL", "evidence_source": "example", "record_ids": ["example-1"], "expected": true, "observed": false}},
  "failed_invariants": [{"code": "EXAMPLE", "message": "not runtime evidence"}],
  "overall": "FAIL"
}
